{
	"schemaVersion": "1",
	"resourceSpecId": "resource-spec:textpack-wordnet-ar:arabic-wordnet-lmf",
	"packageName": "@ismail-elkorchi/textpack-wordnet-ar",
	"pipelineId": "arabic-wordnet-lmf",
	"pipelineVersion": "0.1.0",
	"sourceIds": ["source:wordnet:arabic-v4.1.0"],
	"snapshotIds": ["snapshot:source:wordnet:arabic-v4.1.0:v4.1.0"],
	"inputFiles": [
		{
			"snapshotId": "snapshot:source:wordnet:arabic-v4.1.0:v4.1.0",
			"path": "tools/textpack-forge/snapshots/data/arabic-wordnet-v4.1.0/awn4.xml.gz",
			"checksum": "sha256:bd24bee99026ecc773cf51f3dc58979d8424092a49dc80f90b938fb44d32a085"
		}
	],
	"outputs": [
		{
			"resourceId": "wordnet-ar-lexical-entries",
			"path": "resources/wordnet-ar.lexical-entries.tsv",
			"kind": "lexicon",
			"format": "tsv"
		},
		{
			"resourceId": "wordnet-ar-senses",
			"path": "resources/wordnet-ar.senses.tsv",
			"kind": "knowledge-base",
			"format": "tsv"
		},
		{
			"resourceId": "wordnet-ar-synsets",
			"path": "resources/wordnet-ar.synsets.tsv",
			"kind": "knowledge-base",
			"format": "tsv"
		},
		{
			"resourceId": "wordnet-ar-relations",
			"path": "resources/wordnet-ar.relations.tsv",
			"kind": "knowledge-base",
			"format": "tsv"
		},
		{
			"resourceId": "wordnet-ar-quality",
			"path": "resources/wordnet-ar.quality.json",
			"kind": "quality-profile",
			"format": "json"
		},
		{
			"resourceId": "wordnet-ar-lexicon-canonical",
			"path": "resources/wordnet-ar.lexicon.json",
			"kind": "lexicon",
			"format": "json"
		},
		{
			"resourceId": "wordnet-ar-kb-canonical",
			"path": "resources/wordnet-ar.kb.json",
			"kind": "knowledge-base",
			"format": "json"
		},
		{
			"resourceId": "wordnet-ar-quality-profile",
			"path": "resources/wordnet-ar.quality-profile.json",
			"kind": "quality-profile",
			"format": "json"
		}
	]
}
