{
	"schemaVersion": "1",
	"resourceSpecId": "resource-spec:textpack-fr-corpus:tatoeba-french-artifacts",
	"packageName": "@ismail-elkorchi/textpack-fr-corpus",
	"pipelineId": "tatoeba-french-corpus-artifact",
	"pipelineVersion": "0.1.0",
	"sourceIds": [
		"source:tatoeba:weekly-french-2026-06-06"
	],
	"snapshotIds": [
		"snapshot:source:tatoeba:weekly-french-2026-06-06:2026-06-06"
	],
	"inputFiles": [
		{
			"snapshotId": "snapshot:source:tatoeba:weekly-french-2026-06-06:2026-06-06",
			"path": "tools/textpack-forge/snapshots/data/tatoeba-weekly-french-2026-06-06/tatoeba-fr-artifacts.json",
			"checksum": "sha256:850382d60a9aa1b200d294eabf8dbe6c38a29902af8d2a2e02cc53369c6a693a"
		}
	],
	"outputs": [
		{
			"resourceId": "fr-tatoeba-corpus-artifact",
			"path": "resources/tatoeba-fr.corpus-artifact.json",
			"kind": "corpus",
			"format": "json"
		},
		{
			"resourceId": "fr-tatoeba-corpus-quality",
			"path": "resources/tatoeba-fr.corpus-quality.json",
			"kind": "quality-profile",
			"format": "json"
		},
		{
			"resourceId": "fr-tatoeba-corpus-quality-profile",
			"path": "resources/tatoeba-fr.corpus-quality-profile.json",
			"kind": "quality-profile",
			"format": "json"
		}
	]
}
